[
  {
    "id": 1,
    "title": "ライ麦パン（50%・パウンド型）",
    "ingredients": [
      { "name": "強力粉", "value": "200", "unit": "g" },
      { "name": "ライ麦粉", "value": "100", "unit": "g" },
      { "name": "水", "value": "120", "unit": "ml" },
      { "name": "牛乳", "value": "60", "unit": "ml" },
      { "name": "塩", "value": "5", "unit": "g" },
      { "name": "ドライイースト", "value": "3", "unit": "g" }
    ],
    "steps": [
      "① こね：全部混ぜて5〜10分軽くこねる（ライ麦はこねすぎNG）",
      "② 一次発酵：60〜90分（25〜28℃）1.5倍くらいまで。膨らみは控えめでOK",
      "③ 成形：軽くまとめて型へ。ベタつくので手に粉をつける",
      "④ 二次発酵：40〜60分。型の8割くらいまで",
      "⑤ 焼成：予熱220℃。最初10分220℃、その後180℃で20〜30分焼く"
    ],
    "tags": ["パン", "ライ麦", "ヘルシー", "シンプル"],
    "image": null
  },
  {
    "id": 2,
    "title": "サラメ・ディ・チョコラータ",
    "ingredients": [
      { "name": "ビスケット", "value": "150", "unit": "g" },
      { "name": "ココア", "value": "30", "unit": "g" },
      { "name": "砂糖", "value": "80", "unit": "g" },
      { "name": "バター", "value": "100", "unit": "g" },
      { "name": "卵", "value": "1", "unit": "個" },
      { "name": "ナッツ", "value": "", "unit": "適量" }
    ],
    "steps": [
      "① ビスケットを砕く",
      "② 材料をすべて混ぜる",
      "③ ラップで棒状に成形",
      "④ 冷蔵庫で冷やし固める"
    ],
    "tips": [
      "冷やし時間は2〜3時間",
      "ラム酒を少し入れると大人味"
    ],
    "tags": ["チョコ", "冷やすだけ", "簡単", "イタリア"],
    "story": "見た目がサラミに似ていることから、子供へのサプライズ菓子として広まった",
    "image": null
  },
  {
    "id": 3,
    "title": "ブルッティ・マ・ブオーニ",
    "ingredients": [
      { "name": "ヘーゼルナッツ", "value": "150", "unit": "g" },
      { "name": "砂糖", "value": "120", "unit": "g" },
      { "name": "卵白", "value": "2", "unit": "個" }
    ],
    "steps": [
      "① ナッツを粗く刻む",
      "② 卵白と砂糖でメレンゲを作る",
      "③ ナッツを混ぜる",
      "④ スプーンで落として焼く（160℃で20分前後）"
    ],
    "tips": [
      "焼きすぎると固くなる",
      "表面がカリッとすればOK"
    ],
    "tags": ["メレンゲ", "ナッツ", "焼き菓子", "イタリア"],
    "story": "『不格好だが美味い』という職人の自虐ネーミングがそのまま定着",
    "image": null
  },
  {
    "id": 4,
    "title": "パーチ・ディ・ダーマ",
    "ingredients": [
      { "name": "ヘーゼルナッツ粉", "value": "100", "unit": "g" },
      { "name": "バター", "value": "100", "unit": "g" },
      { "name": "砂糖", "value": "80", "unit": "g" },
      { "name": "小麦粉", "value": "100", "unit": "g" },
      { "name": "チョコ", "value": "", "unit": "適量" }
    ],
    "steps": [
      "① 生地を混ぜて丸める",
      "② オーブンで焼く（170℃で15分前後）",
      "③ 冷めたらチョコでサンド"
    ],
    "tips": [
      "焼きすぎると割れやすい",
      "チョコはビターがおすすめ"
    ],
    "tags": ["クッキー", "サンド", "ナッツ", "イタリア"],
    "story": "2つのクッキーが重なる様子が『貴婦人のキス』に見えることから名付けられた",
    "image": null
  },
  {
    "id": 5,
    "title": "リングエ・ディ・ガット",
    "ingredients": [
      { "name": "バター", "value": "100", "unit": "g" },
      { "name": "砂糖", "value": "100", "unit": "g" },
      { "name": "卵白", "value": "2", "unit": "個" },
      { "name": "小麦粉", "value": "100", "unit": "g" }
    ],
    "steps": [
      "① 材料を混ぜる",
      "② 絞り袋で細長く絞る",
      "③ オーブンで焼く（180℃で10〜12分）"
    ],
    "tips": [
      "薄くするとサクサク",
      "焼き色がついたらすぐ出す"
    ],
    "tags": ["クッキー", "軽い", "紅茶", "イタリア"],
    "story": "細長い形が猫の舌に似ていることから命名された",
    "image": null
  },
  {
    "id": 6,
    "title": "ピエモンテ風 素朴菓子",
    "ingredients": [
      { "name": "小麦粉", "value": "200", "unit": "g" },
      { "name": "砂糖", "value": "80", "unit": "g" },
      { "name": "卵", "value": "1", "unit": "個" },
      { "name": "バター", "value": "80", "unit": "g" },
      { "name": "ナッツ類", "value": "", "unit": "適量" }
    ],
    "steps": [
      "① 材料をまとめる",
      "② 成形する（丸や棒状）",
      "③ オーブンで焼く（180℃で20〜25分）"
    ],
    "tips": [
      "混ぜすぎないのがコツ",
      "素材の味を活かす"
    ],
    "tags": ["素朴", "焼き菓子", "地方菓子", "イタリア"],
    "story": "ピエモンテ地方では村ごとに異なるレシピが存在し、名前や作り方も微妙に変わる",
    "image": null
  },
  {
    "id": 7,
    "title": "スモーブロー（北欧オープンサンド）",
    "ingredients": [
      { "name": "ライ麦パン", "value": "2", "unit": "枚" },
      { "name": "バター", "value": "", "unit": "適量" },
      { "name": "スモークサーモン", "value": "", "unit": "適量" },
      { "name": "レタス/野菜", "value": "", "unit": "適量" },
      { "name": "ハーブ類", "value": "", "unit": "適量" },
      { "name": "調味料", "value": "", "unit": "適量" }
    ],
    "steps": [
      "① パンにバターを塗る",
      "② 野菜を敷く（レタス・きゅうり）",
      "③ メイン具材を高く盛る",
      "④ ハーブ・ソース・レモンで仕上げ"
    ],
    "tips": [
      "高さを出すと一気に映える",
      "色は3色以上使う",
      "パンは厚めが安定する",
      "ナイフとフォークで食べる"
    ],
    "tags": ["北欧", "パン", "おしゃれ", "簡単", "盛り付け"],
    "story": "もともとは労働者の昼食だったが、現在ではレストランで芸術的に盛り付けられる料理になった",
    "mood": ["映え", "おしゃれ", "軽食"],
    "image": null
  }
]
